{
  "schemaVersion": 1,
  "manifestType": "world-builder-current-target-runtime-ledger",
  "targetInstallationId": "22222222-2222-4222-8222-222222222222",
  "platformReleaseId": "rsc-current-platform-r0",
  "platformManifestHash": "1111111111111111111111111111111111111111111111111111111111111111",
  "schemaSetHash": "6666666666666666666666666666666666666666666666666666666666666666",
  "variantId": "current-base-v1",
  "variantManifestHash": "2222222222222222222222222222222222222222222222222222222222222222",
  "moduleSetHash": "3333333333333333333333333333333333333333333333333333333333333333",
  "bundleInventoryHash": "4444444444444444444444444444444444444444444444444444444444444444",
  "bundleSpecId": "current-base-predecessor-bundle-v1",
  "bundleSpecHash": "7777777777777777777777777777777777777777777777777777777777777777",
  "inputAdapterContractId": "world-builder-input-adapter-v1",
  "inputAdapterId": "preservation-synthetic-v1",
  "predecessorIdentityHash": "",
  "configurationMigrationIds": ["preservation-config-v1"],
  "stateMigrationIds": ["preservation-state-v1"],
  "serverBuildId": "current-server-v1",
  "clientBuildId": "current-client-v1",
  "activeLauncherRelativePath": ".world-builder/runtime/current",
  "activeMapPackageId": "canonical-map-v1",
  "verificationEvidenceHash": "5555555555555555555555555555555555555555555555555555555555555555",
  "transactionReceiptIds": ["upgrade-0001"],
  "ledgerFingerprintSha256": "eca9455d5438fc54bc26d2c391c474a3ff3fb446fbad1f5fb5d79a50397014e1"
}
